{"baseline":{"path":"evidence/content-acceptance/acc-01-baseline-v1.json","sha256":"3028599302799f12a576f3c1b8ec41b978702dd1970731117a7cb9e523baf0eb"},"candidateId":"68524885ebca4bfb2098a6f1afa80a65e4b68db2b2d8e529c11ab5d9fe14b2e6","canonicalRepresentation":{"candidateId":"sha256(canonicalJson(identity-payload-without-candidateId))","canonicalJsonVersion":"canonical-json-v1","trackOrder":"ascending-track-id"},"schemaVersion":"patternly-content-candidate-manifest-v1","tracks":[{"artifact":{"checksumSha256":"6dbf49191e1082349bf1a12ecf042690957a2c9ba1564ea06394adc1a8a90095","contentVersion":"aws-certified-solutions-architect-associate-authoring-v2026.08.15","releaseId":"patternly-launch-2026-08-25-01","releasePath":"artifacts/releases/patternly-launch-2026-08-25-01/release.json","sourceRepositoryCommit":"6a6fd729b9d45086aa5d4f6cf27ec48ef664811c","taxonomyVersion":"aws-saa-c03-20-node-v2026.08.15","trackId":"aws-certified-solutions-architect-associate"},"familyId":"certification","source":{"canonicalItemCount":2568,"itemManifestSha256":"d9211e2091505f7dfcf9c0dbc96e6866919047fb30a9ff4371be5c8eccaf6733","sourceCommit":"1e35906ccea0f3abbed6814fd828bdc6467318be","sourceFileCount":137,"sourceManifestSha256":"d837d60bb005facbde1fe6520ecb31307b41fa5ebd62a85afac4cb55d2b15477","sourceRoot":"manual/source/aws-certified-solutions-architect-associate"},"trackId":"aws-certified-solutions-architect-associate"},{"artifact":{"checksumSha256":"a4270cb2cdfa26981c57f6041997449bd16ed9b403198deb30d4d9daf595a63a","contentVersion":"backend-system-design-interview-candidate-v2026.08.15","releaseId":"patternly-launch-2026-08-25-01","releasePath":"artifacts/releases/patternly-launch-2026-08-25-01/release.json","sourceRepositoryCommit":"6a6fd729b9d45086aa5d4f6cf27ec48ef664811c","taxonomyVersion":"backend-system-design-interview-workbook-v2026.08.15","trackId":"backend-system-design-interview"},"familyId":"design_interview","source":{"canonicalItemCount":1569,"itemManifestSha256":"5f9d81cb3ed9ff0d5bb5a52e1259f57cd28a8255982785f3b365d4ae58b7a305","sourceCommit":"1e35906ccea0f3abbed6814fd828bdc6467318be","sourceFileCount":89,"sourceManifestSha256":"8cb0a15bcb1c2994a74b419719aca2a9085106da7999641dad5ad06ee3d930ff","sourceRoot":"manual/source/backend-system-design-interview"},"trackId":"backend-system-design-interview"},{"artifact":{"checksumSha256":"ebc0c49fecff8a67a2b0ecbd04f8e4eb78d89e0efff83ad7646b3878c2875138","contentVersion":"ccarp-2026.09.03","releaseId":"patternly-claude-ccarp-2026-09-03-01","releasePath":"artifacts/releases/patternly-claude-ccarp-2026-09-03-01/release.json","sourceRepositoryCommit":"563d1b06b3c51552f177199091fb28ef53ccf2b8","taxonomyVersion":"2026.09.03","trackId":"claude-certified-architect-professional-certification"},"familyId":"certification","source":{"canonicalItemCount":300,"contentVersion":"ccarp-2026.09.03","itemManifestSha256":"95fa7656d3b92dc2113b45ad40bca4f6c327306da31270c68b8d7fba1f335c51","sourceCommit":"846b75fafa1fa0a35590622bebd7b1789c95adf7","sourceFileCount":38,"sourceManifestSha256":"d62e69e8dbd24bd91d09016185bb5cfbe1a6e3ab065344ad259802eecfa5c0f1","sourceRoot":"manual/source/claude-certified-architect-professional-certification"},"trackId":"claude-certified-architect-professional-certification"},{"artifact":{"checksumSha256":"2e894561a314cc724c1c28180fc132125bb6e43968fdf935dc292bc8a3da5402","contentVersion":"coding-interview-dsa-problem-solving-0004","releaseId":"patternly-launch-2026-08-25-01","releasePath":"artifacts/releases/patternly-launch-2026-08-25-01/release.json","sourceRepositoryCommit":"6a6fd729b9d45086aa5d4f6cf27ec48ef664811c","taxonomyVersion":"coding-interview-taxonomy-v2","trackId":"coding-interview-dsa-problem-solving"},"familyId":"coding_interview","source":{"canonicalItemCount":3404,"itemManifestSha256":"8d32e94b0bee05e9a01c650290ba266befe9564b334fbc005d079860c41e82a0","sourceCommit":"1e35906ccea0f3abbed6814fd828bdc6467318be","sourceFileCount":213,"sourceManifestSha256":"fa7e1c4ea91414cb8637e99a5d8eb52aee5f1d738626cca7f7c1cec55e5d747c","sourceRoot":"manual/source/coding-interview-dsa-problem-solving"},"trackId":"coding-interview-dsa-problem-solving"},{"artifact":{"checksumSha256":"38b8301dda80e83bfbb98a9e59257a82d99ff9b410d884b6c4e647eefe6ba7a3","contentVersion":"frontend-system-design-interview-candidate-v2026.08.15","releaseId":"patternly-launch-2026-08-25-01","releasePath":"artifacts/releases/patternly-launch-2026-08-25-01/release.json","sourceRepositoryCommit":"6a6fd729b9d45086aa5d4f6cf27ec48ef664811c","taxonomyVersion":"frontend-system-design-interview-workbook-v2026.08.15","trackId":"frontend-system-design-interview"},"familyId":"design_interview","source":{"canonicalItemCount":1766,"itemManifestSha256":"99071ce3843c6a12302ca75e6209c294b6bf158f0b6b2f63df403bf8eff32e38","sourceCommit":"1e35906ccea0f3abbed6814fd828bdc6467318be","sourceFileCount":88,"sourceManifestSha256":"912d575d340d1bbe681ab00e5cf4bbd38982cdaf6bbd759567b0fe5f1f84f61d","sourceRoot":"manual/source/frontend-system-design-interview"},"trackId":"frontend-system-design-interview"},{"artifact":{"checksumSha256":"732f915e43542ca1318bf32aafd1f2cfab77012eb3c8d236a362a92a993740e4","contentVersion":"google-cloud-associate-cloud-engineer-authoring-v2026.08.11","releaseId":"patternly-launch-2026-08-25-01","releasePath":"artifacts/releases/patternly-launch-2026-08-25-01/release.json","sourceRepositoryCommit":"6a6fd729b9d45086aa5d4f6cf27ec48ef664811c","taxonomyVersion":"2026.08.11","trackId":"google-cloud-associate-cloud-engineer"},"familyId":"certification","source":{"canonicalItemCount":2981,"itemManifestSha256":"6c7a8e18a1a94713aef04ff99956a93fa8efe463ff90d0d293c44cb051ee3cf1","sourceCommit":"1e35906ccea0f3abbed6814fd828bdc6467318be","sourceFileCount":152,"sourceManifestSha256":"de3f95b1dc78d3624f7e42a4c91c6b7b1c2148a2f69f34d0fafb9ec701568853","sourceRoot":"manual/source/google-cloud-associate-cloud-engineer"},"trackId":"google-cloud-associate-cloud-engineer"},{"artifact":{"checksumSha256":"968386e75c9abd4b54401e9876dadba6c0dbd01003aea8cfcad3a8d7027569ec","contentVersion":"microsoft-azure-administrator-associate-az-104-authoring-v2026.08.15","releaseId":"patternly-launch-2026-08-25-01","releasePath":"artifacts/releases/patternly-launch-2026-08-25-01/release.json","sourceRepositoryCommit":"6a6fd729b9d45086aa5d4f6cf27ec48ef664811c","taxonomyVersion":"2026.08.15","trackId":"microsoft-azure-administrator-associate-az-104"},"familyId":"certification","source":{"canonicalItemCount":1288,"itemManifestSha256":"7f8e7ce7a217b9a964102902efdc05ade0188862d115aa531dd9be51b8f3a05c","sourceCommit":"1e35906ccea0f3abbed6814fd828bdc6467318be","sourceFileCount":75,"sourceManifestSha256":"ca3bdfd2de66b2783ea0f670ccaa4f01af5d6736f9f7a3de23cc4fc06ce2d651","sourceRoot":"manual/source/microsoft-azure-administrator-associate-az-104"},"trackId":"microsoft-azure-administrator-associate-az-104"},{"artifact":{"checksumSha256":"474f1a403baf502abe10980ff4d7563493664ef1bad7859e2d0fb0ff65fb92c4","contentVersion":"microsoft-azure-ai-fundamentals-ai-901-authoring-v2026.08.15","releaseId":"patternly-launch-2026-08-25-01","releasePath":"artifacts/releases/patternly-launch-2026-08-25-01/release.json","sourceRepositoryCommit":"6a6fd729b9d45086aa5d4f6cf27ec48ef664811c","taxonomyVersion":"2026.08.15","trackId":"microsoft-azure-ai-fundamentals-ai-901"},"familyId":"certification","source":{"canonicalItemCount":752,"itemManifestSha256":"8e32f1b55b195c4a330dfe06180bbb97e40951155a43c1968284e0d87dfc86c3","sourceCommit":"1e35906ccea0f3abbed6814fd828bdc6467318be","sourceFileCount":5,"sourceManifestSha256":"13a410f133ccdcbe9a81772b62b1bd2809829ca6ff59b57ebb42ae602f732a3b","sourceRoot":"manual/source/microsoft-azure-ai-fundamentals-ai-901"},"trackId":"microsoft-azure-ai-fundamentals-ai-901"},{"artifact":{"checksumSha256":"1e6f4bbe2d78420ae2874969dc9d6ff5142c2cfbe43302fd2959c1f203b09e3d","contentVersion":"object-oriented-design-interview-candidate-v2026.08.15","releaseId":"patternly-launch-2026-08-25-01","releasePath":"artifacts/releases/patternly-launch-2026-08-25-01/release.json","sourceRepositoryCommit":"6a6fd729b9d45086aa5d4f6cf27ec48ef664811c","taxonomyVersion":"object-oriented-design-interview-workbook-v2026.08.15","trackId":"object-oriented-design-interview"},"familyId":"design_interview","source":{"canonicalItemCount":1413,"itemManifestSha256":"e99f443c2478d079a11bf2559dcde661ae58c39a5f48f5160c836122ba7437fd","sourceCommit":"1e35906ccea0f3abbed6814fd828bdc6467318be","sourceFileCount":79,"sourceManifestSha256":"b0aa400ce61dba894a43b3081a355ddeedd82af1a542a7d7a7c79d9d522615e3","sourceRoot":"manual/source/object-oriented-design-interview"},"trackId":"object-oriented-design-interview"}]}
